{
  "schema": 1,
  "id": "demo",
  "kind": "chapter",
  "status": "draft",
  "order": 1,
  "title": { "pl": "Demo", "ru": "Демо-модуль для тестов валидатора" },
  "biome": "praga",
  "teacher": "pan_marek",
  "cefr": "A0",
  "canDo": [{ "id": "demo.cd1", "ru": "Заказываю маленький кофе" }],
  "unlock": { "hard": { "always": true }, "soft": [{ "if": { "item": "it.bilet" }, "hint": "есть билет" }] },
  "lessons": ["demo.s01", "demo.boss"],
  "boss": "demo.boss",
  "phonetics": { "clusters": ["R3"] },
  "renames": { "lx.stary_stol": "lx.stol" },
  "onComplete": [{ "give": "it.bilet" }, { "setFlag": "demo.done" }]
}
