{
  "schema": 1,
  "id": "ch01",
  "kind": "chapter",
  "status": "draft",
  "order": 1,
  "title": { "pl": "Litery i dźwięki", "ru": "Буквы и звуки: диагностика и ремонт" },
  "biome": "praga",
  "teacher": "brzechwa",
  "cefr": "A0",
  "canDo": [
    { "id": "ch01.cd1", "ru": "Услышав слово, выбираю верное написание (≥80%)" },
    { "id": "ch01.cd2", "ru": "Прочитав слово, знаю, где ударение и как звучит каждая буква" },
    { "id": "ch01.cd3", "ru": "Записываю под диктовку простые слова" },
    { "id": "ch01.cd4", "ru": "Диктую имя и улицу по буквам и записываю их на слух" },
    { "id": "ch01.cd5", "ru": "Прошу повторить, говорить медленнее, объяснить слово" }
  ],
  "unlock": { "hard": { "always": true } },
  "lessons": [
    "ch01.intro",
    "ch01.d01.brzechwa",
    "ch01.s00",
    "ch01.s01",
    "ch01.s02",
    "ch01.s03",
    "ch01.s04",
    "ch01.s05",
    "ch01.s06",
    "ch01.s07",
    "ch01.s08",
    "ch01.s09",
    "ch01.s10",
    "ch01.s11",
    "ch01.s12",
    "ch01.s12r",
    "ch01.boss"
  ],
  "phonetics": { "clusters": ["R1", "R2", "R3", "R4", "R5", "R6", "R7", "R8", "R9", "R10"] },
  "renames": {},
  "boss": "ch01.boss",
  "onComplete": [{ "give": "it.bilet_miesieczny" }, { "setFlag": "ch01.done" }, { "line": "kazik.stamp" }, { "line": "kazik.map.first" }]
}
